{
  "trace_id": "trace-ok",
  "schema_version": "0.1",
  "source": {
    "kind": "manual-fixture",
    "path_or_handle": "fixtures/trace_pass.json"
  },
  "frames": [
    {
      "frame_id": 1,
      "present_seq": 1
    }
  ],
  "resources": [
    {
      "resource_id": "r1",
      "kind": "texture",
      "format": "rgba8",
      "width": 64,
      "height": 64
    }
  ],
  "events": [
    {
      "event_type": "assertion",
      "seq": 1,
      "frame_id": 1,
      "pass_id": "p1",
      "stage": "decode",
      "slot": "0",
      "resource_id": "r1",
      "assertion": "frame_count",
      "verdict": "pass",
      "provenance": "gpu"
    }
  ]
}
